Filename,SciSpacy Biomarkers,BiomedNLP Biomarkers
A (44).pdf,"MMP7, gastrointestinal cancer, CACC, carcinoma, cancers15, UC, Colorectal cancer, SLC16A9, CXCL8, human, cancers, cancer16, intestinal, samples, TIMP1, Colitis-associated colorectal cancer, rectum, colon, sigmoid colon, ulcerative colitis, IBD patients, CRC1, cancer, CXCL1, bowel, PLAU, CRC","improved, crc, rank aggregation, ss, ca, ##tro, ##tum, ##el, ##tive colitis, fe, uc, connections, expre, colorectal cancer, hsa - mir - 194 - 5p, ib, five - year, colon, o, 15 %, cancer, severe, treatments, 147, 950 new, 1, bow, ul, hsa, lower, slc, c, int, gene co, cr, mir - 378a - 5p, systems biology, system approach, di, expression network analysis, commons, of medical, . 5 – 2. 4 times higher, associated, ##cc, om, data - cent, lower colon, of medical sciences, stages, messenger rna, – 2. 4 times higher, hub, ut, is, university, ##7, mir, disease progression, ibd, ##16a9, creative commons attrib, 53, 200, hs, experimental, inflammation, micro, deaths, medical sciences, sl, ##cera, rec, reproduction, colitis, biomarkers, - fold, ##estinal cancer, rectum, ##cerative colitis, 53, 200 deaths, hsa - mir - 378a - 5p, rra, biology, ##adan"
A (45).pdf,"patients, nonmetastatic colorectal cancer, tumor, plasma, MARCKS-like protein 1, cancer patients, patient, Colorectal cancer, L. H., gastrointestinal malignancies, tumor cells, Cancer, exosomal proteins, cell, cancers, protein kinase C, immune cells, calcium-dependent calmodulin, MARCKSL1, metastatic colorectal cancer, PKC, tumor necrosis factor, cytosol, metastatic CRC, colorectal cancer, CA19-9, exosome, cells9, metastatic lesions, EVs, extracellular vesicles, tumour DNA, serum tumor, stage II, non-small cell lung cancer, CEA, tumors, actin cytoskeleton, Exosomal, Lab Autom 21, Cancer J Clin 71, alanine, cancer, MARCKS, immune cell, metastatic colorectal, CRC","dna, ##ristoy, ##sicle, ##ectal cancer, ep, natural science foundation, small, ev, recur, ##gno, ca, gut, mcrc, protein 1, traditional chinese medicine, colorectal cancer, ‑, marcks, 185, limited, within 5 years after, ##stasis, ti, less than 20 %, alanine rich protein kinase c substrate, cancer, circulating, tumor, 3 - years, 20 %, press, my, grants, mi, circulating extracellular ve, lesions, marcksl1, ##mes, ##mark, – 45 %, ##oso, ##tokines, metastasis, cr, ce, exosomal, ##omics analysis, 5 - years, ##nclusion, pro, mc, conditions, ##c, derived noncoding, stage ii and iii, june 2023, commons, screening, ##static, cancers, lung, profiles, microfluidic exosome analysis, biopsies, ##ssibili, 4, ##oco, non, app, used, cancer transformation syndrome, i, biopsy, oncogene, ex, inflammation, meta, ##ti, marc, 36, ##sta, 15, missed, color, metastases, tiny, ##al cancer, liquid, elevated, broad - spectrum, shu, ##estinal, rnas, open, ##al, ##osomal, ##ect, proteins, ##ks, imaging examinations, university of tradi, po, ##gnancies, ultra - sensitive"
A (46).pdf,"MMP7, MF, CDC20, mast cells, Cellular, Colorectal cancer, CRC Colorectal Cancer, CLCA1, Cancer, CDK4, CDC25B, MMP1, neural network, immune cells, Z., BP, K. D., J. L., IQGAP3, colorectal cancer, CRC tissue samples, UHRF1, Cancer J. Clin, CDK1, TEAD4, F., E., H. A. DNA, TRIB3, SLC7A5, CRC","crc, rf random forest, roc receiver, bioinformatics, machine learning lasso, source, mmp, ml, e, of, next - generation se, expressed, activated mast cells, ellular component ppi, roc, 2035, machine learning methods, operator, gbm, cancer, expression omnibus, cc c, least, sv, cl, omnibus degs, ##s, normal, artificial neural network, high - throughput sequencing technologies, selection, cr, ##p, machine learning analyses, immune correlation, 2d, li, abbreviations, 2. 5 million, ##c, gene ontology, geo, - 6 1ww, genes, om, combinat, sharif, 7543, kyoto encyclopedia of genes and genomes, of technology, global, gradient boosting machine go, immune cells, rna - se, related, ##m support, university, iq, ##7, microarray, absolute shrinkage, ion, kegg, nin, gene microarrays, mf molecular function bp, 152, 810 new, science, tea, cd, vector machines ann, cdc, ##8, sl, ##ga, technology, color, ##al cancer, functional enrichment analysis, dna microarrays, ##0, 53, ##al, differentially, ##ect, ##a, cdk, gene expression, biological process, protein - protein interaction, auroc area"
A (47).pdf,"patients, GEO, ra n o n ., c g a d, NOS2, Colorectal cancer, Cancer, colon cancers, cancers, Patients, c, Cytoskeleton, c . 2 1 7 0 8, muscle cells, IRDEGs, H. E., K. D., malignant tumor, samples, colorectal cancer, metastatic CRC, Cancer J. Clin, rectal cancers5, IL-17, nitric oxide synthase 2, K-M, actin cytoskeleton, gastrointestinal tumor, CXCL2, cancer, CXCL1, ECM-receptor, CRC","treatment, cancer burden, crc, ##gs, l, tcga, 0. 1 0 3 8 / s, immune, enriched, cy, ##mun, 0, ss, ##finding, ca, mode, 10 years, colon cancers, commons attribution - noncommercial - noderivatives 4. 0, eight, regression analysis, 4. 8 %, 9. 5 %, 2 2, e, than 50 years, overlapping, tina, ##oth, nitric oxide synthase 2, 185, cxcl, significantly enriched, ecm, its, different clinical features, 9, 900 000, ##oc, eocrc, validation, year, ##era, forest map, tumor, ##toskeleton, 1, 321 degs, expression, 326, ##ea, ##rc, univ, pathways, cxcl1, gene, survival, ##d, roc curve, 7, corre, cox, 2021, biomarker, vivo, cr, six, ,, gs, 41, on, m, clinical, chemotherapy, nine, ind, nos2, low risk scores, geo, genes, many cancers, february 2025, more than 19 million, 119, hunan university of medicine, ##static, 5 - 88, late, 5, 9 8 - 0, cancers, different, enrichment, in, cxcl2, global, validation analysis, related, samples, ##in cytoskeleton, 4, 4 %, 0 8, il - 17, surgery, nos, %, meta, ##5 degs, rectal, 6, im, deaths, 36, os, cox regression analysis, 207, 11ww, march, sensitivity, hunan provincial science and technology department, tcga group, department of gastrointestinal, 3, second people ’ s hospital, september 202, decreased, tc, 2, 202, signaling pathways, ##py, high, sixty, scientific, ariate, 136, 1. 1, k -, wa"
A (48).pdf,"patients, tumor, Fig.5, LowPS HighPS Patients LowPS HighPS Patients LowPS HighPS, TGFβ, cells, stage II/III CRC specimens, applicationof, Colon, FHL3, Supplementary Fig. 1, tumor specimens, FHLproteins, HCT116 cell line, Patient, CRCColorectalcancer, HiScript III RT, stage II/III CRC patients, TGFB1, N0) 1.97 1.15−3.37, stage II/III CRC, TATCAACGGG, cancer, Rectum 91(44.8, pN2 disease, TGFBI","crc, 34 ( 32. 7 ), 0, ##gno, 0. 007, tgf, 60, basedfra, ##gt, images, rt supermix, ), 0. 0, 162, ##weretheprimersequencesusedforrt - from, well balanced, ib, p, 274 ( 82. 3 ), ##atients, ##ispl, tumor, 26, ##pl, externalvalidation, ##ction, pn2 disease, 123, pts, transfection of, ##ceiveroper, 112, 6. 1, ##ct, 3 ) 155, ##totalrnaiso, cr, 79, 81 ( 39. 7 ) 30 ( 47. 6 ) 51 ( 36. 2 ), 36. 5 ) 26, converted, chemotherapy, 55. 9, hr, published, 70, 106 ( 52. 0 ) 35 ( 55. 6 ), 1., ##discovery, 195, 62, 3. 2 ), stage, samples, lowps, sirnas, pcdh - cmv -, ##curvestop, 74, 19., forwards, ##ion, female, 71, 108, i, was, 62. 7 ), ##san, 54, ptstage, studies, 33 ( 23. 4, 63 ( 60. 6 ), 3, ##gg, no, tc, rectum, ##theint, fhl3, f, 128, asa, we, if, 33. 8 ), ., 174 ( 85. 7 ), ci, 191, ##horeceivedtreatmentat3aca, ##to, 1. 0 ) 2, ##la, ##ithstage, 2. 81 1. 33−5. 96 0. 00, 77. 0 ), 76. 6 ), 02 1. 21−3. 63, ##hort, 53 ( 84. 1 ), 0987654321s, 84 ( 41. 4 ) 37 ( 48. 1 ) 47 ( 37. 3 ), quantitative, stage ii / iii, pc, lipofectamine™ 3000 reagen, ##d, 119 ( 58. 6 ) 40 ( 51. 9 ), ab, 79. 4 ), ze, ##teomic profil, 41 ( 39. 4 ), 87 (, 90, ##dfsanalysesine, quan, - iii, value application, . 1, pro, mc, 57. 4 ), 96 1. 19−3. 22 0. 008, 60. 3 ) 33, ##ity, 63. 8 ), ##tologytype high, 85. 7 ), ##onthex - axis, axioskop - 2, ct, calib, 0. 003, 14, hc, 48, stage ii /, colorectalcancer, 58. 6 ) 65, ##udy, 38. 1 ), methods, 57, internal, ##omo, 83. 7 ), cells, complementarydna, ≥65, 40, ##ofpatient, ##tc, sol, re, ##ca, 2, high, thisst, cdna, ##du, ##trans, pt, disease, clinical routine variables, 2. 75, hiscript iii, ##oftotal, tgfb1, 20 ( 31. 7 ), 85. 6 ), free, of, t, colon, ##byusing vector ’, ##bi, 91 ( 44. 8 ) 35 ( 45. 5 ) 56 ( 44. 4 ), 9, ##survival, clone, 42, ##iss, reverse, tgfβ, ing analysis, pt1, 73, ##zy, ##anal, ##elt, 77. 8 ) 61, rt - pcr, ##of, missing, ##t, tt, qpcr, pl, his, signature, . 6 ), 97, ##asmi, low, ##ps, . 2, 2., ##c, 97 1. 15−3. 37 0. 014, academic institutions, sex, 67 ( 87. 0 ), 142 ( 42. 6 ), ##t116 cell line, 158 (, npj, 16, ##on, internalvalidation, g, ##gene, ##par, ndahalflimdomains3, ##com, ##sur, 20. 6 ), 8, 52. 4 ), 74 ( 32. 3 ), ##kitv2, specimens, 107 ( 84. 9 ), 11 (, ##reverse, 78. 1, ##ex, externalvalida, 113 ( 80. 1 ), 89, ##ach, clinicalcharacteristicso, ##anda, 7 ( 3., pnstage, and, 20. 7, systemic therapy, clinical validation, keyprotein signatures, e, 166 ( 81. 4 ), 108 ( 32. 4 ), 35. 8 ), 2. 01 1. 15−3. 52 0. 014, ##gram, forwardstcacggagatggtgatgagccaand, roc, ta, tumorlocation, validation, ##sw, va, 1, male, ##3, 1. 46−5. 17, 99 ( 43. 2, 53 ( 37. 6 ), ##ds, ##tom, ##the, ##probability, ##w, ##jacentnormalcolorectalmucosafrom60patients pnstage, 138 ( 41. 4 ) 39 ( 37. 5 ), . 7, . 0, 13, n, pt2, 260, ps, transient, < 65, ##otted, 2 ), proteomic profiling, 95 %, 5, in, (, ##pse, ##iate, 7 ( 11. 1 ), ##and, 74., ##m, ##omics, 1. 38−4. 96, ##df, ##withtheremarkguidelinesfortumormarker ps, 740, 98 ( 48. 0 ) 28 ( 44. 4 ) 70 ( 49. 6 ), ##yzedacohort, pt4findings, label - free intensity - based, ##demiccenters, training, ##ship, rec, 187, 67. 7, 171, 101 ( 44. 1, ##fect, afastpurecell / tissue, 0. 002, ##tage, ##lation, 62. 5 ) 130 ( 56. 8, highps"
A (49).pdf,"urine, liver, neutrophil elastase, Tissue, Fabrice@mayo.edu, human, stool-derived EVs, Extracellular vesicles, stool, secretin, cellular, USA.3Departmentof, NETs, bacterial- derived proteins, stool EV, pancreatic juice, esophagus, visithttp://creativecommons.org/licenses/by/4.0/., SD):10kDa:19.37%±12.00,30kDa:19.53%±10.86,50kDa:18.70%±8.56, radish, SEC, ELANE, colon, spleen-derived, blood, neutrophil, C, resultsin, lipids, small intestine","size, -, ##hatcans, ##gno, ##filtration, ##oscope, ##valida, ##down, ##evsincrc, ##hat, ##divisionofgastroenterology, concentrate, basedcm, ##rnapost, onevreco, proteomics, super, for, cow, pig, potato, radish, almond, thesefindingsdemon, receives, spleen - derived, ##ind, indicating, stool supernatant, ##meta - evsb, ##analysis, ##er, ##cent, ##competing, orange, ##opa, ##dis, ##used, ##ments, ##ons, human, to, bystatutoryregulationorexceedsthe, ##ular, 16. 05, clinicalcharacteristic, but, ##so, withalargersamples, ##needtodevel, bo, centrifugedat2000×g, cr, ##ted inventor, ##yourintendeduse, ##ep, ##ont, lipids, ##vid, individuals, ##ran, ##concentration, ##r ’ srecommendationuntilthe, ##ain, ##find -, ##×, small intest, ##4000×gperthemanufa, clinic institutional review board, ##ome, removeanycellulardebristhatwasnotremovedduringinitial, ##fo, ##agepercentvesicular, proteomicdatasupport, several, ##materialint, samples, ##con, nets, ##pernatant, ##ified, ##scriptomicanalysis, additionalinformation, ##fuged, was, ##prior, ##te, littletonovariationwasob, ##ofastool, ##her, ##gh, ##omes, dynamic, ##cts, ##ofsto, stoolsu, exclusion, volume, fraction, ##nucleica, secretin, ##coming, proteins, ##acomprehensive, ##outsidethevesicles, ##cter, ##rnaamo, 10, ##at, at, we, if, . 53 % ±10. 86, 50k, ##toolstoint, ##co, ##tech, derived, ., ##21, ##tractwiththelargemajority, ##olume, ##forisolationofstool - composition, ##streamapplica, size - communicationsbiology, ##sic, ##avariety, ##hil elastase, . 18, ##to, ##valuated, supplementarymaterial, ##var, 228, api, ##ava, complex, end, ##pro, waspassedthroughthe, ##13, ##hort, ##non, ##rea, ultrafiltration centrifugal, lower, ##ting, allotherauthorsdeclaren, el, ##aratee, ##d, ##bilayerandc, ##olevproteome, ', ##methodbasedon, all three domains, ##lar, ##earcha, neut, ##contentofcolon -, protein, ##stratethatultrafiltration, ##separa, ##limport, ##frame, youwillneedto, ##thecopy, enzymatictreatmentrang, . 29 %, ##ted, ##tm, licensed, ##previous, ##purity, ##atic juice, ##min, ##aver, following sec complexes ( rnps ), ##tose, ##with, und, ##work, ##k, consumptionandderivedfromchi, ##mwcoa, ##forfutures, ##vera, ##massspectrometryexperime, ##inas, ##prote, stool - derived, ##cture, density gradient centrifu, ##tions, ##permissiondirectlyfrom, ##due, ##per, ##vr, 202, techniquesuchasultrafiltratio, ##reative, ##be, ##les, ##may, ##stic, forth, ##he, ##fromevs, fluid, ##line, ##islikely, mass spectrom, consensus molecular subtype, the, u, ##not, ##rem, ##uo, ##notincludeat, ti, ##andca24, ##differ, our, ##sforpatientsinthelarger, ##ese, pan, ##ilable, ultrafiltration, ##of, ##rial, wedonotrecommendtheuse, ##combinationof extracellular vesicles, sc, ##iomark, ##fluen, ##nalytical, phospholipid, ##proces, 2d, ##ov, ##patientswere, ##leprotein, therefore, colon, liver, esophagus, derivedev, from, ##na, ##omic, buffer solution, ##ol, supernatant, results, evs, transcriptomicprofilingofcrchasledt, ##ful, ##rop, cellular traps, ##ies, ##gesamplev, betweenmwc, ##oft, ##yougiveappropriatec, ##andrecoveryparameter, 37 %, ##thecombinationof trointestinal, optimal, ##greementbetween, 63, sec, ##versioncontains, ##ub, humanbody, ##wedonotanticipateadifferentoutcome, ##isolationto ingsthatwillserveas, sponsored, supplementaryinformation, ##par, uf - 100kda, ##ole, as, mass spectromet, ##ition, ##ultra -, stool, ##80°, ##swithhighsensit, contamination, ##id, ##potentialofstool - derived, ##nat, wei, filters, given, ##ach, continuouslyaspiratedfromth, myelo - uncoverthehumanandbacterialproteomeofstool - derivedevsisolated, 3d, ##f - 100kda, differential centrifu, thee, ##s17., which, ev, ##pe, and, ##vb, ##43 %, ##vis, ##tion, ##8 %, 100kda, ##vsfromsoluble, , 000, derivedevshavenotbeenwell, ##tha, e, mw, ##his nihgrantsca214679, ##inate, o, ##amp, ##ertodisruptrnpsanddigestanyrna, ina, ##ant, this, ##sicular, stooliscomprisedofw, ##att, visit, derivedevsorig, 1, ##are, ##errogate the, ##dd, ##fr, ##very, ##ige, extent, norultracentrifugation, ##tom, ##lite, wetreatedevfrac - becauseitwouldlikelyresultint, ##ri, ##can, ##the, cms, ##ffe, ##ofthes, ##cefficiently, ##whichroyalt, ##in, ve, ##commonslicence, tissue annotation, ##di, ##ima, 30, ##puri, ##ev, ##lipoprotein, 10http, ##biopsy, ed, ##fm, in, ##proteomicsstudies, (, ##othe, 10min, chromatography, these, ##pre - analytical, ##fromthe, ##and, 4, iables, ##m, ##ums, ty, 100k, prote, ##severalkeycompone, ##etry - based, fewstudieshaveinvestigated, ##res, study, ##gfor3, ##is, ##niquest, ##ci, . 70 %, ##byexactsciences, most, ##ce, classification, obtain, ##usion, ##methodswithproteinasekandrnasea filtrationmolecularweightcut - off, ##pa, of life, ##mal, ##ther, ##fu, ##viewacopy, food speedvacuumtoconcentrates"
A (5).pdf,"TW, patients, early-stage CRC, stool DNA, plasma, CNDP1, DDA, matrix, carnosine dipeptidase 1, leucine, CEA) [, TF, DNA plasma, patient, carbon, Colorectal cancer, early-stage, alpha-1-acid glycoprotein 1, Septin 9, Human samples, CA125, LRG1, IGFBP2, pancreas, CRC patients, A liquid biopsy, NPV, stool syndecan2, Plasma, CRC [, line, LDT, CA242, SERPINA1, ORM1, insulin-like growth factor binding protein 2, serpin, Huang Q, Serum CEA, serum NSE, benign polyps, fecal, liver cancer, publi, LL, colorectal cancer, CA19-9, Peripheral venous, APC, Br J Cancer, plasma samples, ITIH3, FIT, colorectal-cancer, inter-alpha-trypsin inhibitor
heavy chain 3, CEA, DNA, blood, PXD042639, CRC plasma, seven-protein, FG, cancer, PXD042652, DIA, ple, C9, cial, cancer-, CA724, CRC","dna, cea, crc, l, ca12, ca19 - 9, 95, seven - protein cla, locked, ##mete, 0, ##he, dia, hundreds of peptides, dd, ca, fixed cut, cndp1, alpha - 2 - glycoprotein 1, cn, auc, methyl, rs, pro - tein, epi procolon test, 11. nakamura, septin, colorectal cancer, negative, based, plasma samples, ##ates, dyna, p, blood sampconcl, multiple, multi - reaction monitoring, ti, two, ##cy, col - specificity, assay, panel, cancer, ##2 level, 73. 8 %, complement c9, blood tests, multi, improvement, 0. 905, mutation, pan, regulated, npv, liver, regression, mrm, gene methylation, window, my, fit, benign, quantitative, ##5, mdg values, human, ##t, mr, fo, translational medicine, ##mark, au, up, peptide sequences, 88, types, ##ych, labo, testing, biomarker, endent, september 2020, ld, cr, reproduction in, ssifier, ,, 92. 3 %, apc, blood, ##pina, 905, ##chang, 13, clinical, dna testing, protein, blood test, ind, ##c, average, ser, ca724, septin 9, serpin family a member 1, carnosine dipeptidase 1, machine learn -, ##creas, inter - alpha - trypsin inhibitor heavy chain 3, features, chinese, specific, hospitals, stages, 2 years prior, ##rd, stage, ca24, samples, : 188 page 7, ##usions, deposited, mass spectrometry background, ##m, alpha - 1 - acid glycoprotein 1, leucine rich, ##on, down, und, non, est, –, ##ated dna, quantify, i, biopsy, bmp3 / ndrg4, it, biomark, early -, invasive, insulin - like growth factor binding protein 2, ia, plasma, did, ##y, locked logistic, carbon nano - tubes, 909, ##ay, 87 %, creative commons attribution 4. 0, plasma proteome, thi, peripheral, the per, stool, dda, color, ##al cancer, col, proteomic analysis, liquid, han, or, translational potent, improving, mass spectrometric data, open, z, ##al, ca19, 2, ##ect, stool syndecan2 methylation test, proteins, k, , adaptation, distribution, healthy, ##psy, variation, mass spectrometry, ##gf, regulation, bio, imperial, serum, ##obt, f"
A (50).pdf,"colorectal, malignant cancer [3], Cancer Cell Int, anti-cancer, Colorectal cancer, Ha D, gests, gastrointestinal tract, cancers, Sci, bladder organoid, Kim D, line, Wu Q, stage III colon cancer, Verrill C, adenoma, Rep., Shin K, colorectal cancer, samples, Linder N,, lncRNA LINC00974, portal, tissue, cancer, stage-specific, sug-, CRC","crc, -, declines, lnc, commons licen, decreas, ., commons licence, network, u, medicine, center, st, early, colorectal cancer, five - year, ##oma, ##00974, t, de - mirnas, cancer, year, colorectal, 147, 950 new, mali, 1, significantly, using deep learning, 37 degs, au, ##can, his, 90 to 40 %, sci, de, cr, 90, malignant cancer, bladder organoid models, ##ous - stage, pre, intelligence, . 0, gas, rr, ##c, th, ##adan university of medical, lin, of medical, adenoma,, 200, artificial intelligence, ed, machine learning, cancers, multice, based sciences, gma, stage, adenoma, nter study, ##cer, systems, deep learning based, 53, 200, five, anti - cancer drufind, ##bution 4. 0, aden, origin, im, 950, gastrointestinal tract, 40 %, ##sts, ##trointestinal tract, ge, 53, 20, 147, retrospective, de - lncrna, ##i, stage adenoma, commons at, analysis, artificial, ##gnant cancer"
A (6).pdf,"B cell, STXBP6, breast cancer, plasma, trans pQTLs, fur-, GREM1, CSAG1, osteo-, single-cell, colon tumor tissue, rectal cancer, FUT3, Colorectal cancer, B, epithelial cells, cells, UK, human, monocytes, cell, cancers, CD86, ADPGK, CHRDL2, TIMP2, line, CXADR, pancreatic cancer, T cells, cell-type, Log 2 FC, fibroblasts, urothelial cancer, colorectal cancer, POLR2F, sup-, tissue stem cells, SMR locus, colon, colon tumor tissue cell, monocyte, Joint, CLSTN3, tissue, colon cancer, cancer, endothelial cells, adipose tissue [, teome-wide, MMP2, teins, CRC","l, 10, interactive pairs of proteins, rigorous analyses, ##words, ep, nature science, enriched, mr design, 0, ur, therapeutic drugs, obesity, summary, ., fut3, calization analysis, urce, 12, mmp2, > 0. 5, screening b, the, class, 05, log 2 fc >, two proteins, avail - of 13, den, meta - analysis, 09, t, colon, te, multiple, two, gability evaluation, cancer, pro - color, committee, our, cell expression, f, fur, bay, tumor, 1, not, gr, expression, , proteome - wide, mi, . 4 %, pathways, ma, biol, heidi test, levels, ing, cl, protein - s12 – s, mr, fu, measured, c, ##mark, failed, ##d, able, ##st, plasma proteins, natural science fund, normal, utic drugs, leveraged, single, pol, cr, eli, six, ##t3, ##rape, commons attribution 4. 0 international, ##ra, plots, ##in, mg, tissue, 13, 13 proteins, seven, timp2, protein, cd86, ectal cancer, ##c, tim, th, an, sm, heidi, malig - teome -, pp, ##mune, replication, screening, insufficient, drug, ##delian random, ##tal, genetic instruments, open access reso, cod, ch, enrichment, them, stage, 1. 9 million new cases, ##ian randomization, plas, - evidence, 0. 05 level, est, g, lia, colon cancer, finngen, 0. 9 million, csa, study, five, cell ‑ type specificity, plasma, four, 15 : 75 page 2 of 13, men, rectal, cells, cs, ##ithelial, deaths, human protein atlas, young scholars, random, distinguished, fide, tion, ##tl, studies, instruments, trans pq, ##em1, rec, trans p, color, smr, col, protein - coding genes, ##q, elevated, trans, heidi tests, epide - of, biomarkers, clstn, decreased, ##ie, coding genes, 2, ##rdl, k, proteins, clas -, et, ##qtl, type, plasma protein, ##ian randomiza - mary, ##xadr, 11, ##em"
A (7).pdf,"K.D.;Jemal, five-protein, P.;Wilson, Sixofthe27proteinmarkersweresignificantlyassociatedwithCRCriskin, MDPI, body [, F.Globalpatternsandtrendsincolorectalcancer, F.R.;Karin, CRC","thee, written, ##sight, ##ssmento, ##de, ##candmayfa, ##he, ##asse, ##roved, - like, ##tudya, ##pop, ##rolesofobesity, ##jun, new, ##tion, ##oftheseprotein, ##playersfornearlyallessential, odds, ##kines, ##tet, ##tum, ##xi, etiologyofcrcandmayfacilitat, ##ysesshowedconsistentassociationsforallproteinswiththeexclusionofcases, ##sintothetumormicroenvir, cytok, ##arecriticalplayersfornearly, iss, the, for, with, involved, ##ft, ##fied, ##hein, ##withcrcriskinbothdiscoveryand, ##asesan, ’ shealth, ##ec, ##1. 9million, ##onment, ##patternsand, like, ##ology, 09, ##alle, ##isticrolesofobesity, multiple, ##to, ##processes, ti, restricted, ##biomarkers, ##1. 54, ##hand1. 88, circulating, this, cancer, informed, ##colorectal, ##ing, ##mechanistic, our, ##ava, ##hecreativecommons at, ##me, ##att, ##ctor, ##pro, ##tein, 1, ##are, institutional, ##app, ##ofcirculatingproteinsasriskfactorsorbiomarkersfor, ##toproteinsforwhichextensi, ##ons, ##zing, ##itical, ##ffiveproteinmarkers 1 -, ##play, largely, globally, ##of, ##2022, ##alsolinkedproteins, am, matrix - de, chemo, ##orwhic, ##crcandm, ##d, ##e2022, ##st, ##lta4, int, ##by, ##timate, ##the, ##can, ##ulin, ##cancer, ##ila, ##sin, conflicts, cr, ##p, ##totherapidriseof, ##da, ##ins, ##mation, ##forcr, ##cr, increase, ##appro, ##ns, coldsp, ##ep, ##proteinmarkerswer, ##processesint, ##date, ##fully, ##ofproteinsinthehumanbody, ##aths, ##orth, ##pp, ##pot, 27, ##vid, sd, ##di, ##validationsets, conditions, restrictedtoproteinsf, ##cd, ##wc, 30, ##tee, ’ shea, isthethird, ##low, previous, published, five - protein score, ##fa, ##bynih, ##approximately1. 9million, ##mapsand, ##ulation -, thedatapresentedinth, ford, ##claim, 06, ##ob, ##ath, cancers, ##ofci, ##ducted, ##oft, ##grad, ##cilita, ##sinto, ##was, ##case, inresponsetosystemicinflam, ##priorknowledgeofthemechanisticpath, ##ear, ##dt, ##ive, ##ju, ##int, ##facultyofdentalmed, ##cer, ##con, ##achemployedinthosestudiesis, ##21july, ##ub, ##and, ##vel, nest, ##as, ##30, ##ands, ##biological, ##with, ##mate, ##matedt, ##bu, circulatingpro, apaneloffiveproteinmarkers, 71, colorectalcan, ##com, ##flam, ##hattheglobalcrcburdenwillincrease, ##60 %, inresponsetosystemicinfl, ##neat iwatemedicaluniversity, ##newcasesand, . 9, colorectalcancer, it, ##res, ##eth, ##he27, apanelo, idenovelinsightsintothe, ##sulinandi, ##withcrcr, ##udy, ##fl, ##va, ##obe, ##guide, controlstu, 22, ##ti, ##mill, . 9millionne, ##ay, ether, ##mo, ##ways, dateofapp, ##population -, ##proteinsasriskfactorsorbiomark, ##idenovelin, ##ble, studies, ##growth, 10of11, ##tomaj, color, ##findingsprov, ##ly, sensitivity, 3, ##ca, ##0. 9million, ##ond, or, ##1, itises, mdpistaysneutral standarddeviation, ##fu, basedstudiesreportedsignificantassociationsofcirculatingproteins, 2, ##ight, ##table, ##dateapproachemployedinthosestudiesis, proteins, ##lev, inthed, shanghai, matrix - degrading, ##cis, ##tutionalaffil - ia, ##ectal, ##ulinres, ##sf, ##nal, ##casesand, proteinarray, ##sulinandinsulin, inverse, ##patient, ##cilitatetherisk"
