Filename,SciSpacy Biomarkers,BiomedNLP Biomarkers
A (28).pdf,"colorectal, DepartmentofMedicine, LDL, lipid, UK, Cancer, Received:14August2024Revised:4March2025Accepted:21March2025, TN, Shu1, Theimagesorotherthirdparty, colorectalcanceFUNDING, Zheng 1, ketone, epide-, FAs, followedbytwo-sample, thepotential, colorectum [, low-density lipoprotein, ShuaiXu 1, colorectalcancer(CRC)isthethirdmostcommoncancer, cancer, lipids, triglycerides, CRC","##f78,, vanderbiltep, ##lofcancer, crc, pt, disease, ep, -, ##biobankparticipantsofeuropeanancestrytoidentify, we, per, ##images, ##95 % confidence intervals, ##de, ##he, ##ystatistic, metabolism, if, competinginteres, dysre, and, variants, european ancestry, ##co, syndrome, residual, ##ty, ##25, ##tion, odds, youwillneedtoob, ( mr ), genetic instru, followedbytwo -, competinginterests, lipid confoundingandreversecausation, the, ke, ci, ##metabolic, ##sum, during, ##tha, ##delianrandomization ( mr, ##gly, ##ology, ##delian randomisation analyses, acid, uk, ##ind, 2025, ##satura, [, p, fas, association, ##io, ##hichobservationalstudies, ##writing, hd, ##23, ##missiondir, ##biomarkers, ##timatehazard, this, 230, ##dianfollow - up, ##usa, department, wide, ##del, 1, vanderbiltuniversitymedicalce, included, ##ty acids, ##used, ##yourintendeduseisnotpermittedbystatutory, ##bol, exposure, weidentifiedmultiple, mi, ##ons, ##foundingandreverseca, ##of, ##9, mr, ##asmasamples, ##icateif, ##mark, tri, cox, abnormalities, ##so, ##association analyses, ##decisiontosubmitthemanuscript, ##thor, ##mar, ##au, genome, 2, 410, ##al carcinogenesis, cr, ##bank, ld, ##bystatutory, ##inpl, lipoprotein lipids, ,, densitylipoprot, ##ubmitthemanuscri, cis, metabolic biomark, ##cr, using, ##yourintendeduseisnotpermitted, pre, low, ##in, ##nce, ##werem, ##gus, ##moncancer, ##interpre, ##fat, ##di, ##c, energy metabolism, ##uk, colorect, 21, 30, associated, , 143controls, published, ##ization, nuclearmagneticresonancespectroscopywas, ##oprotein, ##107, 143contro, ##fa, ##lipoprotein, improv, ##colorectal cancer, ##yslipide, ##ted, conducted, metabolic, ##for, colorectal carcinogenesis, ##oprotein abnormalities, ##time, ##107, ##tivecommonslicenceand, (, ##ac, britishjournalofcancer, british, fa, is, several lip, two - sample, analyses, ©, introduction, ##7, several, ##bolomics, ##ian randomization, ##cer, toes, ##tur, ##and, ##tos, ##bed, 4, vanderbilt - ingram, ##ian, ##omics, 14, 473, ##bu, investigate, ##tain, ##par, metabolic biomarkers, ##com, ##24, ##ost, proportional hazards models, ratios, ##f, ##using, ##ses, fang, youwillneedtoobtainpermissiondirectly, as, biomark, cox proportional, weidentifiedmultiple crc, ##cca, ##orotherthird, ##ologic studies, ##lsofeur, . 7year, 732, ##y, ##toquanti, large, ##genome, meta, metabolic reprogramming, men, ##dm, random, ten, ##97, ##cision, studies, ##criskwithpercentagesoflinolic, color, ##orexce, ##id, 420, elevated, 199, ##lip, ##un, altered, shu, regulationorexceedst, ##per, decreased, ##gulation, ##78, 473, 202, ##ofhi, ##2025, ##ect, ##formed, lip, approach, ##lev, increased, ##ame, ##smallnumbersofparticipants, density lipoprotein, ##vernovelbiomarkersfortargeted, ##lipide, ##tof, ##tow, hazards, ##marystatistic, regulation, bio, d, f"
A (29).pdf,"patients, Stroma, BRAF, SARIFArepresentstheH&E-basedcounterpartofanaggressivetumor, stage II patients, DoMore, neoplasms, patient, JNK, UK, Cancer, CRC patients, ofsome, p=0.650,hypermethyla-, Theimagesorotherthirdparty, gui-, AstraZeneca, gastrointestinal, TheAuthor(s)2023, stage II, Cancer Control/Tumor Node, GS, DNA, Sutterella, CRCs, BM, NHS, stage III, tissue, cancer, colorectalcancer, CRC, creativecommons.org/licenses/by/4.0/.","##sis, ministry of education and, ##alaffi, crc, disease, ##at, kaplan – meier, ##images, ##he, ##gno, 4a, higher, ##nk, provide, and, if, ms, ##bra, ##roma, & e, evaluation, ##pres, ##ty, iii, ##ando, progression, ##totheori, ##ssuchasco, ##nsen, ##alink, ##95, cancergenetherapy, ##l, the, ##bystatu, free, hat, dance, appropriate, ##orotherthirdpar, ##use, st, ##achessuchasconsensus, e, ##oth, ##h, ##base, negative, based, t, easy - to - other, 69, ##ricanjointcommittee, h & e, ##forrefinedpati, ##hylati, year, microsatellite, ##fference, man, ##haracter, tumor, ##sw, over, ##lu, ##ase, tn, repair, ##asa, routinely, ##more, ##app, mis, status, for health and care research, h, heterogeneous, stage iii, ##erafindingsunderscoresarifa - status, materialint, partial, cm, ##rial, ad, . 8million, ##you, enabled, survival, ##mark, ##shavenoconflictof, mmr, stage ii, positive, ##the, competing, ##s, ##ache, b, really, ##au, nosari, ##germanacademicexchangeservice, cr, sar, ##oxyl, ##ricanjo, ##nse, ##appro, ##asanidealbiomarker, therapy, ##markerforrefinedpatientstratificationandnoveldrugdeve, 8million, on, ##in, tissue, decreases, significantly decreased, pro, evident, protein, ##ro, ##di, research, . 0 %, colorect, sarif, youwillneed, other, ##ina, ##counterpartofanaggressivetum, ##tee, program, 10. 4 %, ##ms, ##cc, ##fa, ##ents, upregulated, ##he5, ##rectly, hypermet, ##alcancer, ##aj, ed, creative commons express, easy - to - other routinely, diagnostic, ##ma, survival endpoints, gui, ##ginal, stage, rapidly decreases, ds, surgical treatment, ashe, 2023, ##its, ##and, ##tis, specific survival, ##as, dependent, survival (, ##m, est, ##bio, 90 %, t - stages, ##com, clinicopathological features, ##dontheame, ##istic, ##under, ##indicateifchangeswerem, colorectalcancer, ##f, ##eth, ##beobserved, ##sus, biomark, ##if, ##psand, rapidly, could, bacteria, ##is, crcs, neoplasms, ##ti, partly, meta, ##ere, ##ment, ##nosignificant, deaths, cancergen, ##ndeosin, ##sta, os, ##nideal, j, ac, group, least < 0, gui -, ##v, ##mat, ##thecreative, ##ded, or, cb, honor, assessment, biomarkers, robust, tc, bra, open, ##f v600e mutations, event, ##ab, ##resarifa - status, ow, domore regulationorexceedsthe, high, ##poor, positivity, gene - expression - based, ##a, species, ##ctive, sarifa, ##tre, - y, ##wise, ##tu, analysis, bio, gene expression signature, ##ught, leading"
A (3).pdf,"colorectal, stool DNA, SiegelR, Rho, rectal cancer mouse, MAPRE1alone(P¼0.0007foradenoma, Texas.5DepartmentofInternalMedicine, Colorectal cancer, Cancer, colorectal cancers, likelihoodratiotest).The, P<0.0001foradvancedcolorectalcancer, MAPRE1, SOD1, P¼0.0003foradvancedcolorectalcancer, adenomas, P¼0.0025foradvancedcolorectalcancer, ReyJF, colorectal cancer tissues, adenoma, colorectal cancer mouse, fecal, Z. Feng, colorectal cancer, human adenoma, plasma samples, rat, colonic tissues, CEA, colorectalcancerandSOD1inadenomascomparedwithcontrols, blood, precancerous colon tissues, P<0.0001fortotalcolorectalcancer, colorectal cancer tumors, tissue, Q., cancer, colon adenomas, colorectalcancer, earlycolorectalcancer, JemalA.Colorectalcancerstatistics,2014.CACancer 3, BretthauerM","cea, 0. 731, ##de, ##yield, ##antly, ##0. 793, ##tet, ##ectalcan, advanced, ##leadingcauseo, ##color, ##oth, ##isementin variable, ##al cancers, ##er, ##isa, humanbiologyandpublichealths, ##x, found, ##result, ##pl, ##ea, cl, ##mark, but, ##so, biomarker, , ormaterialsupport, ##re1alone, ##cofthetwobiomarkers, blood, ##rford, ##su, ##articleweredefrayedinpartbythe, colorect, ##his, plasmamapre1, 1de, ##lowe, ##iv, stage, ##tal cancer, fc, ##nb, ##inthe, early colorectal cancer, ##her, ##gh, ##sol, ##denomascompared, ##while, com, ##mo, mapre1, ak, ##als, ##ect, chemical, ##menand, ##al cancer tumors, ##stool, ##ca152746, ##wer, colonoscopy, ##scompared, 10, ##at, we, ##son tests, ##pres, ca, ##co, ##enotic, ##achcolorectal cancer group, - sion, ##topromotecellmigrationandinvasionincolorectalcancer, ##uni, ##oma, combination, colon adenoma, ##to, ##colorectal, ##combination, ##mento, ##amine, ##bet, ##ofoundincrease, <, ##ssion, ##e, ##anadditive, ##invasive, ##es, ##d, ##cie, ##testsf, ##alcancerands, ##au, colon tissues, ##sitivityinthisst, induced colo - thecostsofpublicationoft, pre, ##inear, ##comb, ##¼, ##5 - year, ##boththeadeno, ##pre, detecting, ##ity, third, ##ma, ##andhasbeen, ##forqualityassuranceincolorectalcancerscreen, 66, page, adenoma, ##01, ##cer, ##hichan, ##previouslycharac, ##as, ##with, ##ize, ##if, ##elevatedinbot, distant, 2015, ##ele, ##thatmapre, cancercenter, ##art, ##eldedthehigh, biomarkers, lassologistic, ##ter, ##malevelsofmapre1, healthy controlgroup, 2, ##tp, colonic tissues, 45, - fe, ##effectoft, ##edetec, ##together, ##thatofc, ##he, r, od, map, the, mouse, ea, plasmabiomarkerfornasopharyngealcarcinoma, early, ##iot, based, colon, 9, ti, grantsupport, ##fi, tab, ##creen, ##ing, ##signif, ##ination, ##sinplasmalevelsofclic1inprecl, ##sit, ##tibodieswereprintedonthemicroarrays, ##of, ##t, normal, ##alone, ##po, ##pretationofda, ##translational trials, obesit, reduced, occult blood test, tissue, approximat, clinical, ##pre1, ##ina, texas, ##mapre1, ##wo, ##ymentof, - date, ##ebymarkeda, ##for, specific, cancers, ##oft, ch, ##no, ##ance, ##was, ##ear, ##owing, ##regre, ##cting, ##bu, ##mapre, ##hi, . 0025, ##erine, ##colorect, plasma, healthy controls, meta, ##ere, stool, ##al cancer, ##wereal, ##ex, ##al, ##1ex, withhealthycontrols, 3d, ##tthereforebe, ##sensitivity, ##ls, ##ely, sod1 protein expression, ak1, and, ##ceayieldeda, fe, tality, ##tha, colorectal cancer, ##alcancerandadenoma, ##ete, ##stasis, te, likelihood, colorectalcancersw, ##uc, cancer, this, orb, increases, ##cal, ##vate, ##od, 13 %, ##icate, ##95 %, ##ofmichiganmed - binedwithafecali, ##by, ##can, ##the, localized, dna test, ##w, ##epart, ##ade, plasmacealev, research, ##onofearly - stage, ##curable, imperiale, over many years, ##vert, ##ncesd, ##rdeathi, 95 %, ##tri, ##ford, 5, 91 %, ##mus, ##lo, in, ##0. 400at, ##eda, university, ##ta, ##lasmama, ##int, ##its, ##plete, ##and, ##cancon, human adenoma, ##ificantly, rat, ##ability, ##othermachinelearn, colon adenomas, ##orcolorectalcan, study, ##cea, ##lycolorectalcancer, icantly, ##bly, ##tovisual, ##ad, ##ized, aden, european, most, guidelines, ##u, rec, color, ##lycolor, ##pa, proteinex, ##1, ##than, ##contro, ##i, ##lev, ##pre1would bed, ##andear, ##th"
A (30).pdf,"microbiome, colorectal, TheStateUniversityofNewYorkat, sig-, weak-, TheSixthAffiliatedHospital, colorectal adenoma, adenoma, samples, LPS, USA.4StateKeyLaboratoryofOncogenesandRelatedGenes, ShanghaiJiaoTongUniversitySchoolofMedicine, gut microbiome, People’sRepublicofChina.5SchoolofMedicine, US1, adenoma-cancer, colorectal adenoma patients, QIIME2, cancer, adenoma-specific, colorectal ade-, CRC","##16srrnase, time, crc, – 15, ##sho, 43, enriched, 0, ##de, we, -, ##ug, 8th, he, processing, new, bioinformatics, obesity, ##single - cello, derived, ##gra, schooloflife, ##toadenoma, guangdong, colorectal adenoma, can - leave - one - dataset - out (, the, reads, ##thed, center, markers, inflammatoryboweldisease, ##tha, control, ##∆, microbial sequencing, ##tt, ##oma, plottedvalues, multiple, heptose, car, ##geststhattheelevatedactivit, 021, ##jia, ##cinogen36, validation, sequence, over, ##ese, tumor, ##rquantificationsofbacterialgenesintheadp - h, adenoma - control model, ##areqrt -, ##asa, ##are, ##nos, rt, ##gun, ##rel, ##ativeabundanceofcandidate, h, ##antenr, ##sitysch, ##fr, key, quantitative, ##ome shotgun, ##gen, ##osehasbeenidentified, pc, ##wed, ##of, ad, to, ##cies, ##graphicinformation, au, ##d, linked, lo, ##the, alterations, ##arkerscould, cr, ##p, microbial, quantitative insights, ##lyde, weak, ##guang, ##nthesis pathway, ##oton, ##iver, ##cr, ##sy, - 2, ##ep, ##in, ##andtocrcs, 13, ##ign, nf - κb, 217, ##authorsjointlysupervis, departmentofcolorectalsurger, 1, 800, 000, 4sta, co, ##dur, ##donginstituteofgastroenter, ##ccomp, 252sam, different, ##oft, ##lab, adp, depth, ##fo, ##p - heptose bio, ##shan, ##bial markers, analyses, us1, adenoma, κbs, ##7, ##cer, ##ub, inconsistent, ##and, 85, ##pment, ##on, und, ##pt, ##k, 7these, while, 306, sig - study design, ##school, 16s rrna, ##hebiosynt, ##ji, ##bacteria, ##thes, real, lp, ##ho, harvardmed, ##ad, environment, meta, micro, ##bial, ecology, ##ich, aden, ##ment, ##mo, ##provincialkeylaboratoryofcolorectalandpelvic floordiseases, ##n, 23265, ##edthisw, cers, ##ions, tfinding, studies, ##eb, color, y markers, olorectal cancer, - cancer, 860, 000 deaths, school, tc, 89, ##hesis, 2, 76, ##ience, healthy, shanghai, increased, ##ectal, ##lde, sequencing, 3d, universal, ##tu, sustained, do, ##ag"
A (31).pdf,"patients, early-stage CRC, HCs, tumor, CoreFacilityofInstruments, liver, serum CEA, TMT, NationalCancer, sig-, lymph nodes, pro-, serum carcinoembryonic antigen, CRC patients, NM, Fig.1, f
2, ChineseAcademyof, fic, lymph node, NationalCancerCenter/, LNM, urine specimens, CA19-9, c
7, F
C, FIT, CEA, e e B p r r a o d t f e o i r n d w, tec, C, vit, PRM, cancer, rd, CRC","cea, improved, crc, l, ##mm, 92 %, x, 0, ##de, ##rot, ur, r, 14 %, – 73. 5 %, and, ##vorte, ##mt, ##urinary, ##ate, 3500×gfor30minat, ie, ##hc, ##region, ima, ##ey, fe, u, the, ≥, 96 %, e, 65, ##weremi, ##edsamples, ##h, t, o, le, tmt, p, . 5 %, ##fle, ##suspendthe, car, sis, ##fi, 9, ##henquanti, ##vised, ##gfor, within 6 months, ot, ##protein, ##biomarkers, cancer, ##ur, ##ing, ##wl, ##ese, ##dis, 55, tumor, w, computed tomography, ##t differences, liver, vi, ##plewascentrifugedat, 1, mis, ##inary nancy, fit, h, ##hysiologicalchangesindifferentcrc, ##toreliablydiagnoseandde, ##ure, en, ##of, ##sam, ##t, red, fo, metachronous, c, ##ng, ##lter, ##d, 7, ph, ##dsamplesfromeach, ##withlnmandsynchron, ##2, ##ct, ##by, ##cino, ##can, testing, biomarker, signature, ##the, b, ##s, ##group, ##ffer, ##ence, cr, ce, ##forproteinscience, 1st, ##ry, antigen, ##sc, ninerandomlysel, zhaoxh, ’, ##cr, metastatic signatures, 91 – 97 %, tec, m, ##extractedbyac18extractioncolum, es, y, clinical, ##su, n, nature, ##4 h, ##di, fi, ##c, th, ##tment, ##sp, 30, ##sinthedotblot, ##xedsamplefr, ##gand, three, poor, sex, 13 o, ##91, ##×, 95 %, ##ne, ##tek, 24. 8 %, ##tm, 5, chinese, ##pleswas, yo, ##roupsw, ##lab, (, national, andair - dried, aided, ter, ct, 1 e, ##a -, ##int, embryo, age, 4, ##key, ##re, ##m, 10th, g, ##51 %, hc, ##allymp, 3 n, –, ##par, death protein, ##ntwascollectedandt, 1 o, i, ##teome, na, 8, followed, static, biomark, study, qualified, ##tore, ##o, er, ##do, a, ##85 %, ##molecularoncology, balanced, %, ##ad, distant, meta, ##sive, imaging, ##ofmed, rm, ##dm, ##sta, ##n, ##patientswithoutmetastases, 15, 62 %, serum, 400µloflysisbuffer, . s, ##eo, distant spread, ac, significant, ##ly, sensitivity, 3, ##pa, ##with131tm, ##ous, olorectal cancer, ##g -, ##ded, io, ##pathop, ##per, 9th, ##pool, sc, 2, hen, high, ##orator, diagnosis - related, s, ami, ##centrifugationat14, 000, 3d, ##amo, aberran, ##cp, ##wer, ##thesupernata, d, ##thethree, si, f, ##patient, peptideswere"
A (32).pdf,"nuclear/cytoplasmic, streamtargetstranscriptsintheRNA-Seqcoculturedataset(Supple-, ToinvestigatetheroleoftheIL-1pathwayincolonicCAFs, tumor cell spheroids, F.Managementof, co-cultures, breast cancer tissues, studieshaveturnedtowardssingle-cell sensitiveandresponsivecellsinCRC.HighIL1R1mRNAexpressionin, confirmingitsabilitytoactivatetheNFκBpathwayinCAFs, podoplanin, single-cell, TheAuthor(s)2023, CRC patient samples, CLZ, collagen, CAFs","##forthestudyofthetumors, fig, crc, ##loe, ##orexceedsthe, -, ##de, ##tum, ##fromthecopy, ##serveda, ##ghil, ##l, ##u - single - cell, mycafsandicafs, ##oth, ##ind, ##incafsbytumorcellsleads, two, ##pressing, ##ema, ##x, ##withtumorcellsquanti, ##1r1m, ##theoth, ##ide, tumor, ##used, ##nesecretiontriggered, cl, ##thenfκbpathway, to, but, ##yourintended, culture, additionalinform, ##ermissionsinformation, ##well, supplementarymate, ##nco, ##bystatutory, ##nse, ##activa, ##ep, ##ratedit, ##single - cell, ##ctivation, breast cancer tissues, ##κb, ##fs, ##fo, ##il1r1, is, sw, ##xpressionof, ##has, detect, ##inca, ##ion, ##uldbeaddressed, was, openaccessthisarticleislicensed, single - cellsequencinganalysisidentifies, ##f, ##her, ##gh, ##thi, inflammation, ##sive, ##sandp, caf, ##crcsingle - celldatasets, cultures, anacademichpcc, studies, ##eo, ##material, col, ##hicaf, ##gulation, ##eadyabas, ##culturedataset, ##lke, ##wereeitherisolatfu, ##blisheddatasets, ##lagen, observed, indicated, ##otherw, podoplanin (, extremely, ##type, ##bytheauthor, treatment, ##samples, ##at, we, if, ##genee, ##co, activationoftheil1 -, ##nding decipherscellt, fcytoki, ##uded, with, ##underacreativecommons, ##to, ##previouslypu, ##var, gel, ##bet, ##orcells, lee, ##il, ##questsformaterialss, ang, nuclearp65, ##es, competing, ##isavaila, ##rna, ##ourrna - se, streamtargetstranscriptsintherna, ##lcytokinea, ##mission, ##cus, , anonymous,, ##filei, furthersupp, ##fy, ##nownnfκbdown -, ##α - smoothmuscleactin, ##theincrease, ##ma, ##ac, ##ncreasein cultures, close, ##allthreedatase, ##as, ##with, ##imagesorotherthirdpartymaterialint, ##l - 1pathwaymembers, ##k, ##unpa, ##totumorcellsshowed, ##luster, single - cell, ai, ##hei, ##en, ##sti, ##withtwo, ni, ##strom, apeerre, sol, ##ly, ##ca, ##highhet, ##bution, ##due, ##proteomeprofilerhum, ##per, ##lice, 202, ##viewinformationnaturecom, high, ##reative, ##be, ##amo, pdpn, ##grown, ##gned, sensitiveandres, ##mun, ##vedthatfibroblasts, ##he, ##way, ##ionalclaim, ##pathway, ##cytok, ##queincafcharacteriza - thetumorstromacomparedt, ##nca, ##isspeci, ##pit, todissect, pronounced, ##levated measures, the, of, changeswer, ##tt, review, ##up, ti, ##fi, umorspheroidcul -, ##ing, w, ##rel, ##indicateif, ##ni, ##of, ##t, ##elial, ##intheart, ##toane, ##ule, ’, ##highestp, low, ##ps, ##matorynature, ##duced, ##ransitions, ##intoil1r1, ##c, ##ableinthreeadditionalpublicbulkcrcdataset, ##af, co, ##son, ##expression, supplementaryinformationtheonlineversioncontains attribution4. 0interna, ##icationsthanksfloriangreten, mal, ##for, seq, ##oft, ##xpress, ##was, ##willneedtoob, ##wereeitherpaired, ##ub, ##ioninfibroblasts, ##forth, 1path, ##wee, ##re, 16, ##on, ##ali, ##themultis, ##ykit, ##com, ##hi, ##tate, ##ole, ##pd, reprint, ##looril, as, ##ation, ##rect, ##r, ##fl, men, sub, ##cells, ##withre, ##ble, pathway, caf -, α, ##ex, ##ha, ##und, morerecent, ##sma, increased, il, ##eit, ##ls, thee, vicinity, ##rra, ##am, tures, and, split, inca, fibroblast activation protein ( fap ) 8, cell spher, ##ando, ##tro, 5art, ##orted, ##umber, ##tha, ##r1, ##acreditlinetothemate, ##express, ##press, ##ser, expressingcelltype, single versatile, ##an, visit, 1, ##65n / c, ##are, included, ##usedthetcgabu, ##14, ##veturnedtowards, ##ala, clustered, sequencing library, ##βstimulation, ##fe, 1a, ##tom, ##lypublished, ##by, ##the, ##how, ##sin, ##icle, distribution, ##in, ##mons, ##acopy, ##di, tumorfibroblasts, ##il - 1pathwayasakeyplayerincoloniccafs, myofibroblastic markers, license, ##inn, ##ef, co -, ##zed, ##eakeytech, ##ob, ##lo, ##ired, in, ##eda, ##incol, ##hic, ##int, ##nti, ##its, ##and, ##is, ##cel, ##pro - inflammatorycytok, ##hian, ##tainper, ##meontheresponse, ##pee, ##gate, ##ions, ##inessecretedintotheconditionedmedia, ##eres, ##yse, ##q, ##mainca, ##il - 1, ##ther, ##1, ##significantincrease, ##formed, αsma, use, sequencing, gene expression, il1r1"
A (33).pdf,"patients, TP53andchr20qamplifications(SRC, AS B m R u A t. F mut, g d e u n le e s M, bevacizumab, BRAF, FAM123B, T cetuximab bevacizumab, adenocarcinoma, leucovorinandirinotecan(FOLFOXIRI)backbone, EGFR, Fig.1|TheOncologyBiomarkerDiscovery(OncoBird)workflow.aPatientsin, T, BRCA2andNF1did, ATM, RAS wild-type tumours, left, oxaliplatin, Cetuximab, CMS2 tumours, b, ARID1A, Bevacizumab, TOP1, Cell, somatic, M.W.TheroleofSrcin, BRAFalt/KRASalt/NRASalt, T cetuximab, FOLFIRI, tumour subtypes S, NRAS exon 2-4, tumours, cetuximab, M.Wild-type, tumour, Supplementary Fig. 9, LRP1B, CMS1 tumours, layer","dnatopoisomeraseiisacofactorforc, ##vrus, ##mab, ##with5, ##tionone, ##rialfundingfrommerckkga, ep, -, ##tumour our, 0, epacs, enriched, ##pser, ##iri, ##fromrochepharmaag, ms, ##falt, left - sided, wild type, ##2amp, ##tum, 410, mcrc, ##l, flu, for, ##ind, ##eal, p, ##ackedbenef, ##analysis, were, acizuma, ##x, 50, left−, ##regimenswithmeas, ##atments, geneticbiomarkers, 0 −2 −1, ##ste, to, ##cies, h i, 100 % + + +, ##mark, ##tic, ##had, ##2, ##vacizuma, b, folfoxiri, 4100 %, ##byprojektdeal, left−sided, ##lighttheaccessi - signalling pathway, cetuximab, ##metastaticcolorectal, brafa, ##nf1, es, ##ite instabilities, sided, months, ##uso, ##iriplus, 25 50 75, ##ome, ##ured, ##fo, ##®, ##theeuropean, la, ##f1mut, ##ras, sr, ##lon, ##ncinganalysis, ##f, ##zard, ##bf, ##cetuximabversusfolfiri, ##ape, alterations months, ##ura, nras, ##sing, /, ##scapeacrossmultipleclinical, such, ##tumourmutationalburden, 3, theoncology, genetic sequencing panels, 0 1 2 better, ##ional, egfr, ##tre, nc, type, ##tu, ##wer, ##mour, ##20, ##ed, f, ##type, ##col, treatment, sho, we, +, coloncan, ll o, ##hc, juninthe, ##xi, ##dnal, ##ucovorinandirinotec, ##bina, ##to, llare, pi, ##rasal, germany, wasreflected, tumour, - sided, 100 months, ##asa, treatment arms, ##nf, ##vi, weleveragedcox, servedonadvisoryboardsforbmsand, ##d, competing, time - to - eventdata, ##rity, ##thebiomarkerland, 75 %, ##by logistic regression models, kr, de, ce, ##p, ##11 - 4, mutations, bev -, quan, ##binaryvariablescapturing, ##side, eneg, ##2mcrc, 25, molecular, ##uding, ##taandodds mol somaticmu, ##alt, ##tuximab, ##arevo, ##ma, them, ##ac, ##rich, ##7, ##ignificantly, ##fan, orectal expression, arms, ##ost, ##high, eatment, overallor, ##bird, ##olfiri, mia, ##ut, tp53andchr20qamplifications, a, micro, ##mourdna, ##en, nrasa, ##sa, grenzach, ##tions, re, 75, ##survivalda, wed, ##ben, ##vo months, ##bution, disc, ##bygeneticalterations, explaining, 100 %, ##be, cetu, 50 %, d, ra, ##intervals, ##may, ##biomarkerdiscovery, ##fire, lavivrus, ##he, r, ##unda, author, ##andclinicalcha, progression, ##vacizumab, ##opeanunion, krasal, wildtype, ##lt, ##csdna, ##tumoursubtypesbase, ##kramoib, 0 %, leucovorinandirinotecan, the, findings, u, twotreat, free, ##gre, ##fied, lrp, ##aisaprognosticmarkerincolorectal funding, backbone, t, ##ofcetuximab, ##did ratios, 75 100, ##fi, randomisation, 0 25, brca2, subgroup analyses, 30 %, ##indicatethedatain, ##s1 tumour, tore, ##ase, right colon, 75 % + + wild type, ##75, ##eros, ##40, ##ni, ##of, ##t, ##hon, plus, ##s, tneitap, ##cancer, fam123b, somatic mutations, ##bot, ##andcms2, s2, 25 0 %, s1, ##rydatain, ##vac, m, ##cess, clinical, ##uomut, ##ati, ##herele, ##ina, g d, ##nt, onco, ##ents, ##®baseds, 52, ##ft - sided, ##ar, ##kin, ##1mut, ##oft, ##no, tu, ap, ##ear, ##vivrus, ##re, g, ##gene, ##udy cancercellproliferation, unstratified, ##cm, kras, as, ##tionof, nr, irs, 50 % + + + + 25 %, ##isexem, mo, + + +, stint, top1amp, 0 1 0 0 1 0 1 0 eludom, ##or, s m, ##vo, 75 % + + f, krasalt, a m, ##l simi, bra, ##al, between, molecular characterisation, k, - be, 100, tell, increased, ##tumours, s, + 0 %, ##wereenrichedin, ##theprevious, braf, ##lu, ##em, ##btr, ##le, thee, ##ls, ##ged, 50 % +, ##masterpro, left hemicolon, ##80, wild, 2 fdr, ##olf, 4 : 5391, ##ft, e, ##drivermutation, plain, ##ersforcetux - tumours, ##oor, le, o, ##amp, ##tat, mutationsin, ##uc, ta, ##an, ##clinicaltrial openaccessfundingenabledandorganized, both, ##out, 1, ##are, ##3, ##cal, ##fr, freesurvival, ##om, cm, ##95 %, so, ##can, ##the, s2 s1, ##ray, alterations, ##ast, v600, ##in, ras, n, aurora, ##ssed, ##ours, ##uta, ##ms, oxalipl, ##effectsizesbyhazard, ##izumab, char, ##tri, number, ##ximab, top, (, ##arm, genetic biomarkers, arid, ##int, these, ##43, ##eque, ##and, ##vance, ##pt, ##earchcoun, ll, ##ap, ##using, ##res, primary, right, received, lacinilc, + 0 25 50, ##cel, atm, ##richedinbot, ##ci, mutuallyexclusivegenemodules, random, weemplofunding, ##ce, j, ##lines, objective response rate, basedmic, ##asalt, altered, ##1, ##right - sided, be, right - sided, confidence, retrospective, rcts, ##birds, epa, brafalt, + + + 0 %, ##patient"
