Filename,SciSpacy Biomarkers,BiomedNLP Biomarkers
A (2).pdf,"patients, CRC tissue, tumor, SERPINF1, plasma, cer, CRC patient, patient, C5a, Colorectal cancer, anaphylatoxin C5a, CRC patients, LRG1, Figure 6C, cholesterol, Plasma, SAA4, neural network, lipopolysaccharide-binding protein, SERPIN, sera, assays.4, C4B, Complement protein C5, colorectal cancer, sup-, immunoglobulin, ceruloplasmin, apolipoprotein C2, SERPINC1, node, C8A, cancer, serum amyloid A4, cancer-, CRC","crc, l, ##gn, complement c5, lbp, gdansk, dia, protein signature, ##oxin, complement proteins, ms, faculty of biotechnology, alpha - 2 - glycoprotein 1, open access pages, 4. 0, ##ei, of gdansk, abrahama 58, ##5a, ##l, advanced, the, plasma proteomics analysis, c4, center, of, lc, commons attribution 4. 0 license, ##cology, - transformed, sage and, 5 year, c5a, ##cy, university of gdansk,, c4b, adeno -, survival rate, cancer, validation, c5, tumor, w, secret, mali, 1, ##ecta, pathologists, may, institute, levels, gamma 2, c, ##tive, ##ra - biomarkers, amyloid, intercollegiate faculty of, - early stages, heavy constant, l cancer, ##munoglobulin, vali, 5 can -, metastasis, cr, ##p, quan, ##lat, cancer stages, on, low, elisa, 13, pro, protein, members, lipopolysaccharide - binding protein, ##c, an, mass, un, ser, antibody - based assays, ##his, 00769, peptide, proteomics analysis, enhanced, complement cascade, in, ##sti -, stages, aftecc, tu, ap, cal, serpin, ##qlr, proteomics characterization, university, protein chan, 4, enh, con, ##uti, linear model, sa, university of, down, sample, app, 325, ##ker plots, i, science, incident, ana, ##te, neural network classification, na, biomark, c8a, plasma, ##cu, ##vas, inflammation, men, 37 were changed, im, pages, 25 %, pe, degradation, serum, cu, anti, rec, develop - gen, color, prom, cat, ##v, ##phy, complement, altered, ge, ##pin, 202, proteins, ate, january, increased, abrahama 58 street, healthy, can - cer progression, ##a, matous polyps, % to, bio, intercollegiate, lower than 10 %, si, apolipoprotein c2 (, c1"
A (20).pdf,"patients, Neovascular Age-Related Macular Degenera-, Cancer J Clin 2021;71(03, Its, Shimura T, Colorectal cancer, Cancer, CebriánA, Material, Patients, beta-2-microglobulin, ProteinTargets, B2M beta-2-microglobulin, colorectal adenocarcinomas, JColoproctol Vol.43 No.3/2023, samples, colorectal cancer, urinary markersinColonAdenocarcinoma, Colorectal, YueF, Cancers, CEA, Colorectal Cancer, CRC colorectalcancer, TheLC, CRC","##identi, ##col, ##olo, ##doncolono, ##ection, 10, ##from, ##tainde - globocanestimatesofincidenceandmortality, 149014, ##de, we, ur, ##gno, jc, and, ca, ##bra, jon, university hospital, ##val, survivalrate, ##hat, ##ate, 216, protein biomarkers, ##functiongeneontologytermann, talcancer, ##dy, there, ##colorec -, valid, ##dia, ##xi, early localized disease, ##idatethesebiomarkercandidatesinalarger, advanced, proteomics, ##vival, the, with, markers, ##ves, ##potential, of, colorectal cancer, different analysis approaches, tenproteins, ##base, oachestoindependentlyverifyandval, 185, ##ind, ##chemist, current, ##ithout, wethanktheteamofresearchers, ##trometry, ##thesebiomarkercandidatesinalarger, ##to, sis, ti, ##fi, surgical be, car, ##wereidentified, ##20. 1, ##analysis, ##al conflicts, crucial, ##isa, this, cancer, ##ur, ##eta, ##authorsdeclarenoconflictso, year, ) - biology, ##in chim act, colorectal, ##dis, regulated, ##teomic, mali, w, ##uri, ##atlythankandack, ##pro, ##tein, ##are, ##asa, 2020, ##crcin, personalized medicine, ##gul, ma, ##cancerstatistics, urinary, neovascular age - related, ##5, ##of, advances, cl, to, gene, ##fromnonpatholog - thisstudy, ##oli, survival, up, ##es, ##ode, ##st, ua, —, int, ##14 %, new cases, bea, finterestrelatedtothis, ##ct, ##the, ##2, massspectromet, lbqp, b, ##cancer, ##forear, 178, cr, ce, cancer group, referred, ##commendthatcrcscreeningshould, ##shi, successfulapplicationincancer, ##ry, ##lowero, ##da, ##ith, 470, 1. 9 million, ##withdiffer - te, ##ep, march2018, ##in, ##aths, macular degenera - tion, ##ue, protein, ##pp, ##tist, identification, ##sassociated, ##c, brasil, ##patientswithcolorectalcan, mass, average, ##pre, 49year, molecular, ##denocarcinoma, us, ##fy, expertrevproteomics, screening, om, ##icalsignificancewithap, ##useofcancer - relatedde, ##theproteomicprofile, ##975. 000, ##static, ##ob, ##ath, cancers, 62, beta - 2 - microglobulin, ch, (, ##ease, subsequentstudiesareneededtoevaluate, ##andthesecondleading, ##andalm, global, ##hassomelim, icalindividualsversus, ##ear, aiming, ##markerprotein, ##itation, ##and, subsequent, ##forth, la, ##as, ##re, ##with, ##patientsthroughdifferentanalysis, ##omics, 14, app, ##tional experiment, department of colorectal, whichisbothdiagnostic, prote, 1396893, ##erfor theearlydetecticonclusion, all, biomark, ##levanceofmass spectrometry analysis, ##90 %. 2, surgery, ##r, ##gh, 21660, ##guide, risk, al, ##proteinsarep, moreshorterrunsforanalyticalmethods, ##sco, ##vic, res, 2015, ##tothereal - life, micro, ##diminishedexpressionofapodisrelatedtolymp, ##ltblood, ##op, ##eval -, ##thelab, ##ver, ##betwee, nancy, 692272, ##ofurinesamples, ##esareneeded, ##sta, ►, 36, ##cl, strategies, ten, ##vers, ##lines, recent, color, faecaloc, ##ly, ##narymark, colorectal adenocarcinomas, ##ca, or, ##lydetectionof, ##npatientsintheexperimental, 2, ##ona, ##i, 45, references, ##led, ##ocarcino - colorectal cancer, ofthecolorectalsurgeryde, mass spectrometry, ##brasileirade, ##tu, proteintarget, martins, colonoscopy, low number, biochemistry and protein chemistry"
A (21).pdf,"patients, GDF15, [7, 9]), rectal cancer, HPT, SPON2, NPV, human hepatocytes, PRDX1, Endoscopy II, cirrhotic liver, C-reactive protein, Osteopontin, colorectal cancer, Ferritin light chain, propor- Endo II CRC, H. H, Serum amyloid, Stachelski, blood plasma proteins, cardiovascular, cancer, ECH1, trefoil factor 3, TFF3, MIF, Human, Colorectal cancer, Tumor, PQC, Eser S, CO9, Selenium-binding protein, PSGL, Glycine-, Tissue metalloproteinase inhibitor 1, Nielsen BS, Haptoglobin, TIMP1, KC, PKM2, CEA, Dipeptidyl peptidase IV, SAA, ulcerative colitis, F., FRIL, Peroxiredoxin-1, [10], colorectal neoplasias, macrophage, Kai K, mitochondrial, DPPIV, alpha 1-acid glycoprotein, lung, Food, glycoprotein ligand 1, Blood, Tanaka T, Colorectal neoplasms, samples, Spondin-2, Endoscopy II samples, Trefoil factor 3, Macrophage, RB, Int J Mol, Transferrin receptor protein, column, CRC, Gelsolin, K, P-selectin, Cancer, A1AG, L., Int J Cancer, dienoyl-CoA isomerase, C-reactive, SBP1, TFRC, Pyruvate kinase isozyme M2, CRC signal, Wheelhouse NM, Crohn’s, serum amyloid A, Prolyl endopeptidase FAP","31, improved, ##minate, arthritis, crc, serological biomarkers, per, differentiate, diego, ca, ppv, rectal cancer, ptidase, ##ym, rate, usa, 957 564 72 240 34 study, ##uvate kinase, np, . 2 %, late stage colorectal, properties, 12, twenty - seven, laboratory automation framework, full, χ, 7 april, markers, literature, early, colorectal cancer, sep, acute phase proteins, 32 299, ##oma, negative, based, blood plasma proteins, p, targeted - mass spec - 37, rb, macrophage migratory inhibitor, gel, crc - related proteins, assay, cancer, this, validation, 171 13 81 9, 28, inflammatory markers, 14 july 2017, trefoil factor 3, 150,, 26, 18 65 12 selected, npv, 1, 405, ha, 150, san diego, ca, 605 340, eight proteins, 34 300 190, ul, mi, ##fr, coli, c, . 5, au, r - endo ii, ##d, crc test, amyloid, int, one, positive, ic, factor, de, cr, improve, transfer, selenium - binding protein, 700, 000 deaths, growth, macropha, low, li, . 1, diagnostic groups, 2017, fi, ind, 0. 80 / 0., ##c, tim, 135, snk, 21, screenifind, pp, large sample set mir, screening, 92121, 4435, colorectal neoplasias, 36 858 510 48 248 17 for, lung, ##lo, classifier analyses, in, ##al method, ##oh, endoscopy ii, acute - phase p, ##mptomatic, page, reactive, prolyl endopeptidase, sp, 92, ##on, sa, ##pt, expanded, g, endoscopy, 35, 71, tr, nt system, primary, as, tissue metalloproteinase inhibitor, ##brino - transl, compleme, ##sol, 4., ##teom, ##y, ##bution 4. 0, four, 4 million, 713, os, pe, cases, crc signal, increasing, lethal, alpha 1 - acid, sensitivity / speci - fi, sb, ak, 1189, proximity ex, 187, color, analytic, 3, machine learning framework, test, 33 966 579, colonoscopy compliance, improves, itt, robust, concentration measures, biomarkers, 249, ##1, 53, ##mpt, 147, ##cerative colitis, 31 %, high, proximity extension, si, sy, 4698 2759 340, combined, hp, 65 171, dis - tive, rotein production, ##bocan, logistic regression, serum, colonoscopy, rd, restrictive"
A (22).pdf,"patients, IGHG4 Immunoglobulin, GPX3 Glutathione peroxidase 3, FGF-21 Fibroblast growth factor 21, membranes, CA72-4 Cancer antigen 72, ProteomeXchange
, plasma, CRC patients [19], liver, CRP C-reactive protein, non-metastatic, Colorectal cancer, serum AGP1, alpha-1-acid glycoprotein 1, cancers [1, peripheral tissues, AGP1, CRC patients, alpha-1-antitrypsin, specimens, tric cancer, cell, plasma A1AT, cancers, plasma AGP1, membrane, serum, LRG Leucine-rich alpha-2-glycoprotein-1 1Laboratory, CRC [, CFD Complement factor D, CRC Colorectal cancer, C1qC Complement C1q subcomponent subunit C, Heat shock protein 90 kDa, FN, A1AT, pores, plasma proteins, serum/, CEA Carcinoembryonic antigen, COMP Cartilage oligomeric matrix protein, malignancies, C4-A, C4B, beta member)
, Plasma samples, fibronectin, colorectal cancer, Haptoglobin, ine, HSP90B1 Endoplasmin, pancreatic ductal, CA19-9, carcinoembryonic antigen, CRC teins, laryngeal cancer, CEA, HBB Hemoglobin subunit beta, high-molecular-weight glycoprotein, blood, biopsy tissues, LRG, evi- larynegeal cancer, Cystatin C, C4A Complement, cancer, malignant cells, bowel, carbohydrate antigen 19 − 9, C9, esophageal cancer [21], CRC","##sis, cea, ##lutat, crc, l, diabetes, ca19 - 9, lrg, disease, ##bohy, bin, -, 0, heavy, combinations, mor, ##bohydrate antigen 19 − 9, dia, fn, ca, ms, can - cat, nm - crc, leucine - rich, less proteins, ##ol university, crc teins, el elute declaration, consortium, can, can - cate, chulabhorn, proteomics, beta, free, ##drate antigen 19, ##geal, lc, den, colorectal cancer, c9, ##ate proteins, weight, c4a, ms / ms, plasma samples, c1q, - common blood - based, p, car, ti, two, c4b, cancer, circulating, ##bidity, best, ##embryonic antigen, tandem, ##marker, found, bowel, complement c4 - b, f, - 4, regulated, pan, mali, 90 k, lc -, lycoprotein - 1, 1, liver, peptide selections, fdr, ha, eight proteins, h, 2020, peptides, immunoaffinity, complement membrane, dis, quantitative, ##ocarc, gpx3 g, mars, lit, am, a1, c, ##mark, up, morta, constant, pores, plasma proteins, ##cino, biomarker, second, mortality, ##ence, single, inflammatory, a1at, alpha - 1 - antitrypsin, cr, ce, hemoglobin subunit, cst3, ##rg, biopsy speci, 14 background interpretation, ##g - be, plasma level, five proteins, guished, blood, label, low, m, ##chang, es, soluble, raw, protein, identification, fi, gas, agp, spectrometry ighg4, colonoscopy, three proteins, ##bronectin (, an, commons, mass, less, − 4 acquisition, cfd complement factor d, candidate proteins, ##ity, wai, third, - 2 - glyco, liquid chromatography, ar, ##hione peroxidase, metastatic groups, ##static, peripheral tissues, ed, ##cinoembryonic antigen, cancers, ch, ##xd040999 (, attack complex, chromatography, up -, ##romatography, high - abundance proteins, immunoglobulin, la, diag -, ##m, alpha - 1 - acid glycoprotein 1, ##omics, ##on, down, g, non, hc, 14, endoplasmin, biopsy tissues, fn ), publicati, mars - 14, agp1, crp, up - regulated, ##teome, elisa enzyme - linked immunosorbent, biomark, ##cre, ag, invasive, hsp90b1, sappasitthiprasong hospital, ##r, - common, ##lc, ##o, costly, plasma, methods, did, through, nos, distant, res, meta, mac, mars -, ##ay, heat shock protein, ##op, low -, plasma proteome, im, ##ptoglobin, ##sta, colonosco, ##bb, ##ryngeal, increasing, tissues, tion, cu, immune response, re, complement, elevated, liquid, altered, down - regulated, fgf - 21 fibroblast growth factor 21, biomarkers, alpha -, decreased, serum / we, c1q subcomponent subunit c, 2, comp cartilage oligomeric matrix, proteins, high, healthy, increased, complement component c9, acute, ##psy, performance, complement c4 - a, hp, combined, faculty of medicine, ##tham, cystatin c, regulation, bio, malignant cells, ft, serum, c - reactive protein, ##munoblot - blood, flow"
A (23).pdf,"JCYJ20200109140814408, plasma, Holdt LM, human patients, carcinoma, Colorectal cancer, human, stage II/III Colon Cancer, CRC patients, Plasma, line, JCYJ20210324120210029, colorectal adenoma, F, FOLFOX, S100A4, publi, colorectal cancer, FOLFOX-resistant patients, Cell, Rasmussen DN, Wan, CTCs, Shin DH, FABP5, PRM, cancer, BMC Cancer, LGALS1, Bareche Y, CRC","lent cancer type, crc, 831, l, at, 0, waiver, ms, ##gal, ##ry - based, colorectal adenoma, proteomics, u, ##olf, ##markers, ##6, ms - based, colon, data, 126, domain, panel, proteomic, carcinoma, ##teome coverage, machine, plasma peptidome, fu, au, changes, alterations, cr, creative comm, spectrometry - based, ru, shenzhen, on, ##in, pro, clinical proteomics, chemotherapy, ##c, mass spectrometry proteomics, mass, rticle, un, molecular, international lic, china, proteomic biomark - allfinding, wai, 21 : 27, ##olfox, machine learning, page 2 of 13, ##teomics, pepita, fa, is, stage, prm, ##cover - ing, targeted, - independent acquisition ( dia ) method, ##omics, non, prote, ##etry - based, ##te, protein groups, ##iling, mass spectromet, orbitrap exploris, ##if, ##r, 0. 908 wi, plasma, ##bution 4. 0, even, com, ##ver, 240, data - independent acquisition ( dia ) method, ##ox, color, ##al cancer, deep, biomarkers, 53, : 27 page 2 of 13, s, depleted, bio, d, folfox, ##ru, f"
A (24).pdf,"patients, Fu Q, tumor cells, gastric cancer, human digestive, BMP1, GNAI1, LCK, metastatic colorectal cancer, colorectal cancer, plasma samples, lung cancer, non-small cell lung cancer, SFTPA2, non-small cell lung, Que Z, Lu X, exosome cargo, cancer, CB, GLIPR2, teins, surface, tumor, Kang [2], liver, cer, Colorectal cancer, blood samples, mCRC patients, CRC patients, YK2022-7, centri-, RAP1B, RAB35, heart, breast, exosomal, blood, tumors, malignant tumors, early-stage breast cancer, Plasma exosomes, Exosomal TRIM3, RAB30, PSMB8, plasma exosome, cancers, serum exosomes, SMAD3, Xia D, liver cancer, CES1, exosome, CD81, Clin Lab Anal, exosomes, PSMB4, plasma exosomes, CRC, UGGT1, early-stage CRC, ITGA4, plasma, MFAP4, Cancer, Liu X, HMGN5, malignant tumor, intestinal, plasma-derived exosomes, extracellular vesicles, kidney, CD63, H, mCRC, stage III, Fu H, Metastatic colorectal cancer, Tumor-derived exosomal","patients, ra, 5 - year, crc, 10, ##ien, tia, ##ectal cancer, disease, enriched, -, 14 %, 8 – 10 ml, derived, commons attribution - noncommercial - noderivatives 4. 0, ter - proteomics, vary, can, network, u, free, early, lc, colorectal cancer, fast, ##ly expressed proteins, plasma samples, itga, ##stasis, *, adju, te, ti, 320d, cancer, ##cellular, year, colorectal, tumor, mali, rise, liver, gr, ##rc, lb, 965, 963, ##gul, junggar road, 2 karamay, ##mes, 83464985, up, ##7, 100 new, clinical pro, ph, ##ysfunc - cance exosomal proteome, ##omic profiling, ied, ##oso, localized, b, cr, ce, breast, ##kan, small cell, ##ins, 83, radiotherapy, - teins, blood, therapy, ##osomal proteins, label, di, pro, fi, gas, ##ry hospital, sion criteria, mc, ##c, uri -, ##gres - f, sm, psmb, ps, dif - ferential expression, china, potent, ##static, ##mot, , 100 new, 5, lung, ##teomics, treated, different stages, incomplete, stage, 2023, mir, drawn, urumqi 8300, 72, ##on, ##omics, ling, non, exosomes, ##vant, disease - speci, 90 %, prote, 994 quantifiable proteins, biopsy, exodeps, cd, plasma ex, it, rap, karamay, surgery, hm, ag, five, er, ex, plasma, ##phorylated, ##ad, distant, ##imogou district, pat, meta, stage iv, isolation, deaths, nary exosomes, zhu, ##sta, gnai, derived exosomes, march, che, ##vo, color, ##um ex, radio, liquid, shu, open, ##al, kidney, 202, large amounts, differential proteins, - karamay, high, 51, ##gres - fied, monitoring, s, exconclusions, north, 968 pro, western blot, highest, d, ##20, haipeng, 287"
A (25).pdf,"patients, Liu Y, NC, microvesicles, Lata, DON, globular particles, CEACAM, v/v/v)], CD66a, W. Extracellular vesicles, urine samples, colorectal adenoma, exosome-like vesicles, human pancreatic cancer cells, colorectal cancer, urinary exosomes, CEACAM7, human cells, C18, CM
, B [ACN-H2O-FA, cancer, tumor, adenocarcinoma, ±, human, CRC patients, formic acid, F, urinary EVs, Oku Y, pos-, ovarian cancer, cor-, Wu MT, Fusarium graminearum, tumors, GH, Lu SC, Cell Commun Signal, Urinary Cellular Molecular, CEAMCAM6, membrane, CEACAM1, Kil YV, Y. Chmp1A, renal cell carcinoma, Hotta T, Fuchs HE, unfixed, CRC [19], EVs, rat, exosomes, Z. Exosomes, Fu WQ, mouse urine samples, Cancer Lett, Feng W, Thaysen-Andersen M, FA, TA, CRC, TEM, non-tumorigenic tissues, CChhoooossee BBMMCC aanndd bbeenneeffiitt, ESCRT-III, ESCRT, urine, K, human urine, CEACAMs, PepMap C18, CHMPs, Cancer, Exosomes, CM, water, joint, long cytoplasmic, Park M. Chmp 1A, CEACAM5, Hornicek FJ, Varfolomeeva EY, serum","##see, stu - ×, crc, tumor suppressor gene, ##ectal cancer, cy, -, density gradient, ev, tration, convenient, ss, microvesicles, ceacam5, ms, aa, 15 min, ##miitt, 18 january 2023, separated, all - trans retinoic acid, ##itt, cc, ##tro, rrees, escrt, ##aa, ##acam, colorectal adenoma, declaration, fe, u, the, mixture, full, super, lc, pepma, ±ma, ##h, acid, easy - nlc, chmp, ± ±, μ, p, [, ##nary, centrifuging, 9, value, ti, pub - lished maps, dissolved, ##var, free liquid, cytoplasmic domain, cancer, ##cellular, tandem, 78, tumor, pan, human disease, adenocarcinoma, tn, 1, vi, ##rran, significantly, su, h, peptides, ##dd, ##om, human, cm, ##t, tt, ##oo, ##mark, differences between, ph, int, ##2, pl, changes, ##s, signature, helsinki, ##yoouur, em, cr, ce, kind, ##inary, ##crt, dent ’, ##ddy, 60 ~ 80 nm, with column, mass results spectrometry, between 2 1 09 ~ 1 1 011 particles / ml × × ×, ##bular par, tumors, ~ 100 nm, on, ceaca, es, y, pro, protein, mobile phase, ##bm, comparable, rr, individuals, ##acams, ##c, data dependent acquisition group, evs, ceacam7, peptide, ##cc, < 0. 05, ##ms, abe, ##aceutica sin, pepmap, invasion, ##lo, representative te, membrane, ch, ##teomics, ##cles, bbmm, 14, 000 g. 100 μl, ##mic domain, in, renal cell carcinoma, fa, ri, ##romatography, mass spectrometer, samples, ##ub, ceamcam6, con, rat, func, ##m, g, ##ffi, ##een, non, exosomes, ated, ##ch, ##inary cellular molecular diagnostics, science, bb, form, ##ic, soci -, cd66a, 180, migration, ##lence, ##aca, ##r, ##o -, c group, ##rro, analytical column, er, ##nee, ##hh, a, urine, ##y, ##ad, ##aarrc, ##osomes, meta, groups, men, aden, exosome - like vesicles, ##oooossee, ##n, serum, tissues, natl, ac, ##u, diameter, color, ##v, – ms / ms, pressed, ##igen, proteomic analysis, biochem, ##ee, ?, ##nn, 22 november 202, ##mps, biomarkers, ##m1, ##al, urinary ex, ##pad prism 5, tem, ceacam1, exoso, proteins, urina, healthy, increased, 1200 / orbitrap fusion lumos, tumor mark, chmps, ##fcm, nc, po, ff, 50 %, ##les, si, c1, pu"
A (26).pdf,"5-oxoprolinase, pyroglutamic acid, urine, valine, phan, hydroxytigecycline, Colorectal cancer, 9,12,13-TriHOME, Cancer, glutamine, Bas-enhetens ALF, line, colorectal carcinogen-, otic, L-glutamic acid, colorectal cancer, cloxacillin, sup-, unit/ provs amlin, L-tryptophan, Body mass, tetracycline, CL, blood, tumor tissue, NSAIDs N onsteroidal, par-, 3-hydroxybutyric acid, glutathione, sebacic acid, CRC","ram, derivative, oxoode, time, crc, l, ##ectal cancer, at, reversed, ##r -, higher, ##ood, uv, ##ty, antibiotic, nsaids n, metabolic features, 12, body, flu, ci, ##home, e, early, ##xytigecycline, negative, o, ##ba, p, [, pi, 9, two, background methods, ##er, cancer, ##cline, ant, wt wild type, sirius +, tumor, ave, 1, cl, ##ic acid, ##bution 4. 0 international, metab - didate, ##st, ph, tri, statutory r, sebacic acid, , 12, mv, pro - one, onsteroidal anti - inflammatory drugs, cr, 3 - hydroxybutyric acid, six, insights, ,, commons attribution 4. 0 international, hydroxy, se, rib, 5 - oxoprolinase, ##ptophan, 13, pro, seven, umea university, availability, multivar, ##c, ##pto, th, val, mass, un, ns, try, wai, ##biotic, ##ution, ##al carcinogen - didates, 37, page 2 of 13, symptoms, monica - an, vip, ##ome, :, ##yr, in, ##ac, 297, ##yroglutamic acid, ##tracy, ##bolite, ox, ##bolomic biomarker candidates, ##cic acid, candidates, micro - rt, ##bu, g, phase, hydro, 9. 7 years prior, metabolic biomarkers, glutathione, ##tam, ##r, death, 11 : 17 page 2 of 13, balanced, image, valine, meta, ##oglutam, 13 -, ##ver, deaths, 36, early detection, ##ox, anti, l - try, color, 3, rror rate, reproduction, ibi -, l - glutamic acid, open, exact, ##ivar, unit, be, um, cv, et, codes, variation, pro -, ##4, bio, ##lu, error rate, 11, ##ess"
A (27).pdf,"patients, DNA, adenoma–carcinoma, UK, cell-freeDNA(cfDNA)releasedintothecirculationbyallothercells, Thorlacius-UssingO, colorectal cancer, Stage IV disease [1, tumour cells, TanQ, precursor lesions, Nutritionalfactorsandgenderinfluenceage-relatedDNAmethylationin, PHM, TothR, ofcolorectal, Am J Epidemiol, CRC","stage iv disease, crc, ##met, ##sho, ##released, -, ##finding, discomfort, ##promising, cell - freed, ##l, sporadic, ##in the, ##influenceage, for, ##ge, ##color, ##now, were, ##greaterthan, year, ##bisulfite, ##mallp, h, ts, c, unsel, ##mark, npt, ph, ##ct, ##2, ##latedctdnamarkersofcrcispo, methylation, cr, ##nel, ##rnalofcance, blood, ##86 %, ##dna, permission, ##emains, ##claim, ##ts, ##arbei, ##icalrecord, ##pid, is, related, ##con, ##variatesin, ifctdna, ctc, slc8, 868, ##o2, spreaddisease, ##alanalysesan, ##thep, ##ofcell, 83. 8 / 100. 000 ne, ##sing, 25 %, ##n, ##eo, ##isthes, ##hylation, ##os, freed, ##a, ##mour, ##upt, ##ed, treatment, ##col, if, ##co, ##lemarkerswerebmp, ##romoterincolorectalcancer, methyl, ##90 %, ##oma, ikzf, ##to, ##bisulfite - treatmentpro, rc, sfrp, precursor, ##hea, ##pro, smoking, ##crcspecificitywas, ##vi, competing, ##au, ##dnamet, inan independent, ##cr, ##a1, options, ##linicaldiagnosis, f blood, ##stagerema, mad, ##ersofcrcispossibleupto2, ##atedctdnamarkersofcrcispo, laboratory analyses, ##donarapid, nutritionalfactors, ##ated, ctdna, ##year, ##nor, ##methylation, cell, ##din, ##ma, ##med, ct, xu, ##7, ##cer, ##cin, ##with, series o, na, ##andgenderinfluenceage, ##neo, ##o, ##thes, risk, ##jou, 83. 8 / 100. 000, ##hy, ##yearspriortotheclinicaldiagnosis, ##lborg, ##methyl, biomarkers, ##per, ##ctalm, ##itivity, high, ##known, ##spriortoth, 50 %, circulation, ##gerema, disease, incidence, ##si, ##he, ##way, ##local, he, ##cinoma, 86, ##15 %, the, ea, unpleasant, ##inan, ##ssibleupt, ##humanre, regio, based, themostspecific, ##colorectal options, ##ing, ##reproduced, informationfinding, ##me, colorectal, ##dinthestatisticalanalysesand, ##ectedpopulationres, ##rel, ##allothercells, ##of, ##dnabase, lesions, mort, aging, above 10 %, ##cancer, population, earlie, ##ith, reduced, ##ps, ##don, from, ##na, ##l of, ##cinnor, ##c, ##ina, ethics, ##sea, ##lportionofdnareleased, screening, ##humanrectalm, greaterthan, ##for, ##oft, ##was, britishjournalofcancer, tu, british, ##tolab, regional, ##personnel, ##re, ##alcan, g, ##com, reprint, ##vered, released, ##ation, invasive, circulatingtumourdna, ##restudy, stage iv, ##sta, ##hylatedctdna, ##pate, liquid, ##othecirculation, ##hesis, ##ara, ##crcs, ##led, highest, dna, thisstudysupportst, ##ationoftheapc1, fli, ##43 %, ##utralwithregard, ##hypot, ##ft, ##tha, colorectal cancer, ##base, ##uc, this, validation, ##an, ##andgen, adjusting, costs, ##sw, detection, ##cal, ##very, ##hyl, cf, ##sam, ##oma –, ##st, ##ison, ##withhypermet, detectionofk, ##cide, ##by, ##can, ##the, 2021, reviewed, freemethylated, thy, ##fthemostcommonmalignancies, ##ssible, ##for8 %, spread, competingint, ##in, ##nce, ##ist, ##pot, ##biopsy, ##se, 5, ##lo, less invasive disease, ##world, ##othe, appr, yu, ##int, ##and, 4, ##m, ##ofdna, ##ap, ##person, ##wayison, ##cel, 22, aden, ##pet, color, ##eres, universityofaalborgcovered, ##mal, ##stageidisea, ##pc1apromoterincolorectalcancer, over a decade, ##set, ##patient"
